Изображения,Название,Артикул,Цена,Валюта,Наличие,Категория,Подкатегория,URL,Описание,Код товара,Ширина,Глубина,Высота,Вес,Количество мест,Размеры,Остаток,Файлы,Вес (без упаковки),Формат,Автор,Издательство,ISBN,Год издания,Количество страниц,Тип обложки,Составитель,Бумага,Печать
https://cdn.entero.ru/mp@2x/5e/32/5e327e3ba832a25bc86711e8a9f9af46.jpg,Ресторанные Ведомости Умное меню. Сделано в Петербурге,Книга 9785604095324,0,RUB,Нет,Профоборудование,Литература для ресторанного бизнеса,https://entero.ru/item/122419,"<p>Книга <a style=""text-decoration:none;cursor:text;"" href=""http://entero.ru/item/122419""><b class=""b"">Умное меню. Сделано в Петербурге</b></a> предназначена для использования как в сфере ресторанного бизнеса, так и в домашних условиях. В издании представлены рецепты, созданные на основе принципов использования исключительно натуральных и безопасных продуктов и умного меню (учет стоимости продуктов, сопутствующих расходов и человеческого фактора). Описания необходимых ингредиентов, пошагового приготовления и сервировок дополнены цветными иллюстрациями с приготовленными блюдами.</p>",122419,,,,,,,0,https://entero.ru/manuals/129385/%D0%9F%D1%80%D0%B5%D0%B4%D0%B2%D0%B0%D1%80%D0%B8%D1%82%D0%B5%D0%BB%D1%8C%D0%BD%D1%8B%D0%B9%20%D0%BF%D1%80%D0%BE%D1%81%D0%BC%D0%BE%D1%82%D1%80.pdf,1.05 кг,60х90/8,"Пращенко И. А., Акбашев З. Д.",Ресторанные ведомости,978-5-6040953-2-4,2020,160,"Суперобложка, Твердый переплет",,Мелованная,Плоская офсетная
https://cdn.entero.ru/mp@2x/84/c6/84c66accfcb5805d0d79f559c8599e8b.jpg,Ресторанные Ведомости Русская кухня от Президента Национальной гильдии шеф-поваров,Книга 9785604095256,0,RUB,Нет,Профоборудование,Литература для ресторанного бизнеса,https://entero.ru/item/122430,"<p>Книга <a style=""text-decoration:none;cursor:text;"" href=""http://entero.ru/item/122430""><b class=""b"">Русская кухня от Президента Национальной гильдии шеф-поваров</b></a> предназначена для использования как в сфере ресторанного бизнеса, так и в домашних условиях. В издании представлены тематические материалы о становлении автора в профессионального шеф-повара от начала карьеры по настоящее время и рецепты русской кухни. Описания необходимых ингредиентов, пошагового приготовления и сервировок дополнены цветными иллюстрациями с приготовленными блюдами.</p>",122430,,,,,,,0,https://entero.ru/manuals/129389/%D0%9F%D1%80%D0%B5%D0%B4%D0%B2%D0%B0%D1%80%D0%B8%D1%82%D0%B5%D0%BB%D1%8C%D0%BD%D1%8B%D0%B9%20%D0%BF%D1%80%D0%BE%D1%81%D0%BC%D0%BE%D1%82%D1%80.pdf,1.05 кг,60х90/8,Филин А.Н.,Ресторанные ведомости,978-5-6040952-5-6,2019,152,"Суперобложка, Твердый переплет",,Мелованная,Плоская офсетная
https://cdn.entero.ru/mp@2x/ea/01/ea018dd818c3c6b6e4a7cee1ab7e1389.jpg;https://cdn.entero.ru/mp@2x/22/4b/224b808fd602478164afd044975615fc.jpg,"Ресторанные Ведомости Секретные материалы кондитеров. Рецепты, продукты, технологии, подача",Книга 9785950014994,0,RUB,Нет,Профоборудование,Литература для ресторанного бизнеса,https://entero.ru/item/122433,"<p>Книга <a style=""text-decoration:none;cursor:text;"" href=""http://entero.ru/item/122433""><b class=""b"">Секретные материалы кондитеров. Рецепты, продукты, технологии, подача</b></a> предназначена для использования как в сфере ресторанного бизнеса, так и в домашних условиях. В издании представлены технологии приготовления, идеи, решения и рецепты различных десертов. Описания необходимых ингредиентов, пошагового приготовления и сервировок дополнены цветными иллюстрациями с приготовленными блюдами.</p>",122433,,,,,,,0,https://entero.ru/manuals/129392/%D0%9F%D1%80%D0%B5%D0%B4%D0%B2%D0%B0%D1%80%D0%B8%D1%82%D0%B5%D0%BB%D1%8C%D0%BD%D1%8B%D0%B9%20%D0%BF%D1%80%D0%BE%D1%81%D0%BC%D0%BE%D1%82%D1%80.pdf,1.05 кг,60х90/8,,Ресторанные ведомости,978-5-9500149-9-4,2018,176,"Твердый переплет, Суперобложка",Аносова Е.Ю.,Мелованная,Плоская офсетная
https://cdn.entero.ru/mp@2x/7b/c8/7bc8e7fec792b46b4fe2ad709d3a4d8b.jpg;https://cdn.entero.ru/mp@2x/f6/16/f61686915048f508dcb00a229b95b5dc.jpg,Ресторанные Ведомости CHEFART. Секретные материалы шеф-поваров,Книга 9785990811935,0,RUB,Нет,Профоборудование,Литература для ресторанного бизнеса,https://entero.ru/item/122435,"<p>Книга <a style=""text-decoration:none;cursor:text;"" href=""http://entero.ru/item/122435""><b class=""b"">CHEFART. Секретные материалы шеф-поваров</b></a> предназначена для использования как в сфере ресторанного бизнеса, так и в домашних условиях. В издании представлены авторские приемы и наработки, подробные практические рекомендации по продуктам, технологиям, оборудованию и рецепты. Описания необходимых ингредиентов, пошагового приготовления и сервировок дополнены цветными иллюстрациями с приготовленными блюдами.</p>",122435,,,,,,,0,https://entero.ru/manuals/129394/%D0%9F%D1%80%D0%B5%D0%B4%D0%B2%D0%B0%D1%80%D0%B8%D1%82%D0%B5%D0%BB%D1%8C%D0%BD%D1%8B%D0%B9%20%D0%BF%D1%80%D0%BE%D1%81%D0%BC%D0%BE%D1%82%D1%80.pdf,1.05 кг,60х90/8,,Ресторанные ведомости,978-5-9908119-3-5,2017,160,"Суперобложка, Твердый переплет",Аносова Е.Ю.,Мелованная,Плоская офсетная
https://cdn.entero.ru/mp@2x/0e/58/0e58dacb420e51b32e98f1b888bb18a2.jpg,Ресторанные Ведомости Секретные материалы барменов,Книга 9785950014963,0,RUB,Нет,Профоборудование,Литература для ресторанного бизнеса,https://entero.ru/item/122439,"<p>Книга <a style=""text-decoration:none;cursor:text;"" href=""http://entero.ru/item/122439""><b class=""b"">Секретные материалы барменов</b></a> предназначена для использования как в сфере ресторанного бизнеса, так и в домашних условиях. В издании представлены технологии приготовления, идеи, решения и рецепты различных коктейлей. Описания необходимых ингредиентов, пошагового приготовления и сервировок дополнены цветными иллюстрациями с приготовленными напитками.</p>",122439,,,,,,,0,https://entero.ru/manuals/129396/%D0%9F%D1%80%D0%B5%D0%B4%D0%B2%D0%B0%D1%80%D0%B8%D1%82%D0%B5%D0%BB%D1%8C%D0%BD%D1%8B%D0%B9%20%D0%BF%D1%80%D0%BE%D1%81%D0%BC%D0%BE%D1%82%D1%80.pdf,1.05 кг,60х90/8,,Ресторанные ведомости,978-5-9500149-6-3,2017,160,"Суперобложка, Твердый переплет","Аносова Е.Ю., Торощин Р.С.",,
https://cdn.entero.ru/mp@2x/f8/f4/f8f44682be1c8b6e29bbab716901740e.jpg;https://cdn.entero.ru/mp@2x/c3/24/c324d2539fcda00c5fd519112e63675b.jpg,"Виолетта Гвоздовская. Ресторанные Ведомости Управление рестораном, который любит гостей",Книга 9785981761119,0,RUB,Нет,Профоборудование,Литература для ресторанного бизнеса,https://entero.ru/item/122477,"<p>Книга <a style=""text-decoration:none;cursor:text;"" href=""http://entero.ru/item/122477""><b class=""b"">Управление рестораном, который любит гостей</b></a> предназначена для использования в сфере ресторанного бизнеса. В издании представлены рекомендации по выстроению системы производственного учета, проведению эффективной инвентаризации, закупке и хранению товара, организации работы каждой из зон ресторана и многому другому. Подробные описания дополнены схемами и таблицами для более легкого восприятия и запоминания.</p>",122477,,,,,,,0,https://entero.ru/manuals/129412/%D0%9F%D1%80%D0%B5%D0%B4%D0%B2%D0%B0%D1%80%D0%B8%D1%82%D0%B5%D0%BB%D1%8C%D0%BD%D1%8B%D0%B9%20%D0%BF%D1%80%D0%BE%D1%81%D0%BC%D0%BE%D1%82%D1%80.pdf,0.4 кг,70х100/16,Гвоздовская В.А.,Ресторанные ведомости,978-5-98176-111-9,2015,232,Мягкий переплет,,,
https://cdn.entero.ru/mp@2x/27/b2/27b28ee2d58dc9ed51b04b843fafb9b2.jpg,Ресторанные Ведомости Битва за гостя на районе. 120 инструментов локального маркетинга,9785604095379,0,RUB,Нет,Профоборудование,Литература для ресторанного бизнеса,https://entero.ru/item/258209,"<p>Книга <a style=""text-decoration:none;cursor:text;"" href=""http://entero.ru/item/258209""><b class=""b"">Битва за гостя на районе. 120 инструментов локального маркетинга</b></a> предназначена для использования в сфере ресторанного бизнеса. В издании представлены рекомендации по бизнес-процессам, которые связаны с инструментами для привлечения гостей в ресторан по территориальному признаку.</p>",258209,235 мм,160 мм,17 мм,0.385 кг,1,258x176x18 мм,0,https://entero.ru/manuals/318035/%D0%9F%D1%80%D0%B5%D0%B4%D0%B2%D0%B0%D1%80%D0%B8%D1%82%D0%B5%D0%BB%D1%8C%D0%BD%D1%8B%D0%B9%20%D0%BF%D1%80%D0%BE%D1%81%D0%BC%D0%BE%D1%82%D1%80.pdf,0.35 кг,70х100/16,Авруцкая И. Тарабрина О.,Ресторанные ведомости,978-5-6040953-7-9,2020,160,Мягкий переплет,,,
https://cdn.entero.ru/mp@2x/1b/58/1b58dfe8292a165dcd93cf73cef304a0.jpg,Авруцкая Ирина Ресторанные Ведомости Битва за гостя. Версия 2.0 2.0 : стратегии и тактики ресторанного маркетинга,9785604095355,0,RUB,Нет,Профоборудование,Литература для ресторанного бизнеса,https://entero.ru/item/258210,"<p>Книга <a style=""text-decoration:none;cursor:text;"" href=""http://entero.ru/item/258210""><b class=""b"">Битва за гостя. Версия 2.0 2.0 : стратегии и тактики ресторанного маркетинга </b></a>предназначена для использования в сфере ресторанного бизнеса. В издании представлены рекомендации по бизнес-процессам, которые связаны с обеспечением питанием посетителей общественных мероприятий. Представляет собой практическое руководство по построению вашего бренда, достижению узнаваемости вашего заведения и обеспечению лояльности ваших гостей.</p>",258210,240 мм,160 мм,12 мм,0.552 кг,1,288x192x14 мм,0,https://entero.ru/manuals/318037/%D0%9F%D1%80%D0%B5%D0%B4%D0%B2%D0%B0%D1%80%D0%B8%D1%82%D0%B5%D0%BB%D1%8C%D0%BD%D1%8B%D0%B9%20%D0%BF%D1%80%D0%BE%D1%81%D0%BC%D0%BE%D1%82%D1%80.pdf,0.46 кг,70х100/16,Авруцкая И.,Ресторанные ведомости,978-5-6040953-5-5,2020,184,Мягкий переплет,,,
https://cdn.entero.ru/mp@2x/57/ef/57ef47371e3927b6275cff7643700515.jpg;https://cdn.entero.ru/mp@2x/f1/b5/f1b56f410ba9cd2f16722c54c7c74bcf.jpg,Инна Щепетова Ресторанные Ведомости Ресторан глазами гостя. Новый взгляд на бизнес,Инна Щепетова Ресторанные Ведомости Ресторан глазами гостя. Новый взгляд на бизнес,0,RUB,Нет,Профоборудование,Литература для ресторанного бизнеса,https://entero.ru/item/258226,"<p>Книга <a style=""text-decoration:none;cursor:text;"" href=""http://entero.ru/item/258226""><b class=""b"">Ресторан глазами гостя. Новый взгляд на бизнес</b></a> предназначена для использования в сфере ресторанного бизнеса. В издании представлены рекомендации по бизнес-процессам, которые связаны с обеспечением питанием посетителей общественных мероприятий. Автор книги Щепетова Инна практически с нуля выстраивала маркетинговый̆ отдел в ресторанном холдинге Iconfood, в состав которого входило несколько разноформатных концепций, осуществила успешные проекты в России и СНГ, а также в Западной̆ Европе.</p>",258226,235 мм,160 мм,15 мм,0.825 кг,1,258x176x16 мм,0,https://entero.ru/manuals/318100/%D0%9F%D1%80%D0%B5%D0%B4%D0%B2%D0%B0%D1%80%D0%B8%D1%82%D0%B5%D0%BB%D1%8C%D0%BD%D1%8B%D0%B9%20%D0%BF%D1%80%D0%BE%D1%81%D0%BC%D0%BE%D1%82%D1%80.pdf,0.75 кг,60х90/8,Щепетова И.,Ресторанные ведомости,978-5-6044967-3-2,2021,160,"Мягкий переплет, Суперобложка",,,
https://cdn.entero.ru/mp@2x/bd/c4/bdc4fcb09951bd672b85b58b5e2bb0b4.jpg;https://cdn.entero.ru/mp@2x/4d/89/4d897344d8a27607ca2e78dc41ea6b52.jpg,Ресторанные Ведомости Умный ресторан: от потерь к прибыли,Ресторанные Ведомости Умный ресторан: от потерь к прибыли,0,RUB,Нет,Профоборудование,Литература для ресторанного бизнеса,https://entero.ru/item/258229,"<p>Книга <a style=""text-decoration:none;cursor:text;"" href=""http://entero.ru/item/258229""><b class=""b"">Умный ресторан: от потерь к прибыли</b></a> предназначена для использования в сфере ресторанного бизнеса. В издании представлены лучшие практики из опыта внедрения бережливого мышления именно в ресторанах России. В каждой главе приводятся примеры из реальных ресторанов, кейсы, разборы ошибок и описания успехов. </p>",258229,235 мм,160 мм,12 мм,0.429 кг,1,258x176x13 мм,0,https://entero.ru/manuals/318108/%D0%9F%D1%80%D0%B5%D0%B4%D0%B2%D0%B0%D1%80%D0%B8%D1%82%D0%B5%D0%BB%D1%8C%D0%BD%D1%8B%D0%B9%20%D0%BF%D1%80%D0%BE%D1%81%D0%BC%D0%BE%D1%82%D1%80.pdf,0.39 кг,60х90/8,Яблокова Ю. В. Спасенкова Е. А. Пантина А. А.,Ресторанные ведомости,978-5-6046513-1-5,2022,208,Мягкий переплет,Табурова М. С. Селяков А. В.,,
https://cdn.entero.ru/mp@2x/d6/5d/d65dec41c4272e0adefb4a53e3241f36.jpg;https://cdn.entero.ru/mp@2x/45/9e/459e1a62aee705c91f6bc5b836fc45ef.jpg,Павел Щучинов Ресторанные Ведомости Формула доставки еды: создание и управление,Павел Щучинов Ресторанные Ведомости Формула доставки еды: создание и управление,0,RUB,Нет,Профоборудование,Литература для ресторанного бизнеса,https://entero.ru/item/258234,"<p>Книга <a style=""text-decoration:none;cursor:text;"" href=""http://entero.ru/item/258234""><b class=""b"">Формула доставки еды: создание и управление</b></a> предназначена для использования в сфере ресторанного бизнеса. В издании представлены рекомендации, инструменты и решения по открытию и ведению работы в сфере доставки готовой еды. Автор книги - практик, запустивший с нуля доставку еды, успешно развивший этот бизнес и сделавший его высокорентабельным - делится личным опытом, рассказывает о совершенных ошибках, предлагает компетентные решения и дает конкретные рекомендации. </p>",258234,241 мм,170 мм,10 мм,0.55 кг,1,265x187x11 мм,0,https://entero.ru/manuals/318113/%D0%9F%D1%80%D0%B5%D0%B4%D0%B2%D0%B0%D1%80%D0%B8%D1%82%D0%B5%D0%BB%D1%8C%D0%BD%D1%8B%D0%B9%20%D0%BF%D1%80%D0%BE%D1%81%D0%BC%D0%BE%D1%82%D1%80.pdf,0.5 кг,60х90/8,Щучинов П.,Ресторанные ведомости,978-5-6044967-9-4,2021,192,Твердый переплет,,,
https://cdn.entero.ru/mp@2x/7f/57/7f57eac576b87c7ff03aa55deb88c42f.jpg,Инна Щепетова. Ресторанные Ведомости Учебник ресторатора,Книга 9785604095331,0,RUB,Нет,Профоборудование,Литература для ресторанного бизнеса,https://entero.ru/item/122422,"<p>Книга <a style=""text-decoration:none;cursor:text;"" href=""http://entero.ru/item/122422""><b class=""b"">Учебник ресторатора</b></a> предназначена для использования в сфере ресторанного бизнеса. В издании представлены рекомендации по открытию и ведению работы в организациях общественного питания. Подробные описания маркетинговых решений дополнены схемами, макетами, таблицами и алгоритмами для более легкого восприятия и запоминания.</p>",122422,,,,,,,0,https://entero.ru/manuals/129384/%D0%9F%D1%80%D0%B5%D0%B4%D0%B2%D0%B0%D1%80%D0%B8%D1%82%D0%B5%D0%BB%D1%8C%D0%BD%D1%8B%D0%B9%20%D0%BF%D1%80%D0%BE%D1%81%D0%BC%D0%BE%D1%82%D1%80.pdf,0.52 кг,60х90/8,Щепетова И.В.,Ресторанные ведомости,978-5-6040953-3-1,2020,232,"Суперобложка, Твердый переплет",,Мелованная,Плоская офсетная
https://cdn.entero.ru/mp@2x/6b/85/6b854d115e28423a90d6e78eef2f736c.jpg,Татьяна Полякова. Ресторанные Ведомости Кофе для Profi. Зерно. Технологии. Оборудование. Рецепты от бариста,Книга Полякова Денисов 9785990811959,0,RUB,Нет,Профоборудование,Литература для ресторанного бизнеса,https://entero.ru/item/122434,"<p>Книга <a style=""text-decoration:none;cursor:text;"" href=""http://entero.ru/item/122434""><b class=""b"">Кофе для Profi. Зерно. Технологии. Оборудование. Рецепты от бариста </b></a> предназначена для использования как в сфере ресторанного бизнеса, так и в домашних условиях. В издании представлены подробные практические рекомендации по работе бариста, оригинальные рецепты и мастер-классы по приготовлению кофе, напитков и коктейлей на его основе. Описания необходимых ингредиентов, пошагового приготовления и сервировок дополнены цветными иллюстрациями с приготовленными напитками.</p>",122434,,,,,,,0,https://entero.ru/manuals/129393/%D0%9F%D1%80%D0%B5%D0%B4%D0%B2%D0%B0%D1%80%D0%B8%D1%82%D0%B5%D0%BB%D1%8C%D0%BD%D1%8B%D0%B9%20%D0%BF%D1%80%D0%BE%D1%81%D0%BC%D0%BE%D1%82%D1%80.pdf,1.05 кг,60х90/8,,Ресторанные ведомости,978-5-9908119-5-9,2018,192,"Твердый переплет, Суперобложка","Полякова Т.А., Денисов Д.И., Цыро С.В.",Офсетная,Плоская офсетная
https://cdn.entero.ru/mp@2x/a7/04/a70467bf86b03dfc50005ecd21e2fe62.jpg,Артур Чистяков. Ресторанные Ведомости Как заработать на доставке еды. Из пункта А в пункт $,Книга Артур Чистяков 9785604095317,0,RUB,Нет,Профоборудование,Литература для ресторанного бизнеса,https://entero.ru/item/122466,"<p>Книга <a style=""text-decoration:none;cursor:text;"" href=""http://entero.ru/item/122466""><b class=""b"">Как заработать на доставке еды. Из пункта А в пункт $</b></a> предназначена для использования в сфере ресторанного бизнеса. В издании представлены рекомендации, инструменты и решения по открытию и ведению работы в сфере доставки готовой еды.</p>",122466,,,,,,,0,https://entero.ru/manuals/129404/%D0%9F%D1%80%D0%B5%D0%B4%D0%B2%D0%B0%D1%80%D0%B8%D1%82%D0%B5%D0%BB%D1%8C%D0%BD%D1%8B%D0%B9%20%D0%BF%D1%80%D0%BE%D1%81%D0%BC%D0%BE%D1%82%D1%80.pdf,0.45 кг,70х100/16,Чистяков А.Л.,Ресторанные ведомости,978-5-6040953-1-7,2020,176,Мягкий переплет,,Мелованная,Плоская офсетная
