Изображения,Название,Артикул,Цена,Валюта,Наличие,Категория,Подкатегория,URL,Описание,Код товара,Ширина,Глубина,Высота,Вес,Количество мест,Размеры,Остаток,Файлы,Вес (без упаковки),Формат,Автор,Издательство,ISBN,Год издания,Количество страниц,Тип обложки,Составитель,Бумага,Печать
https://cdn.entero.ru/mp@2x/75/5e/755efd3c59e45c3df2c5510d54038622.jpg,"Гвоздовская Виолетта Ресторанные Ведомости Готовые решения для рестораторов: сервис, бар, кухня. Том 1","Гвоздовская Виолетта Ресторанные Ведомости Готовые решения для рестораторов: сервис, бар, кухня. Том 1",0,RUB,Нет,Профоборудование,Литература для ресторанного бизнеса,https://entero.ru/item/258197,"<p>Книга <a style=""text-decoration:none;cursor:text;"" href=""http://entero.ru/item/258197""><b class=""b"">Готовые решения для рестораторов: сервис, бар, кухня. Том 1</b></a> предназначена для использования в сфере ресторанного бизнеса. В издании представлены необходимые и полезные для работы шаблоны и чек-листы, бланки оценки, формы, описания того, как использовать каждый документ, как его внедрить и адаптировать, в том числе пошаговый план улучшения работы в каждом направлении.</p>",258197,250 мм,200 мм,30 мм,0.891 кг,1,275x220x33 мм,0,,0.81 кг,84х108 1/16,Гвоздовская В.,Ресторанные ведомости,978-5-6046513-4-6,2022,141,Твердый переплет,,,
https://cdn.entero.ru/mp@2x/a0/2a/a02a72ed19e32d3137213e4b469b43b0.jpg,Гвоздовская Виолетта Ресторанные Ведомости Рестораторы России. Опыт лидеров. Том 2,9785604651353,0,RUB,Нет,Профоборудование,Литература для ресторанного бизнеса,https://entero.ru/item/258200,"<p>Книга <a style=""text-decoration:none;cursor:text;"" href=""http://entero.ru/item/258200""><b class=""b"">Рестораторы России. Опыт лидеров. Том 2</b></a> предназначена для использования в сфере ресторанного бизнеса. В издании представлен опыт лучших, сильных, ярких женщин-рестораторов в построении концепций, формировании команд, работы с гостями, создания больших компаний и управления ими.</p>",258200,230 мм,180 мм,30 мм,33 кг,1,253x198x33 мм,0,https://entero.ru/manuals/318024/%D0%9F%D1%80%D0%B5%D0%B4%D0%B2%D0%B0%D1%80%D0%B8%D1%82%D0%B5%D0%BB%D1%8C%D0%BD%D1%8B%D0%B9%20%D0%BF%D1%80%D0%BE%D1%81%D0%BC%D0%BE%D1%82%D1%80.pdf,30 кг,60х90/8,Гвоздовская В.,Ресторанные ведомости,978-5-6046513-5-3,2022,368,,,,
https://cdn.entero.ru/mp@2x/0f/b0/0fb0d92e719b51840e6454f7544a1b04.jpg,Ресторанные Ведомости Учебник бармена,9785604496763,0,RUB,Нет,Профоборудование,Литература для ресторанного бизнеса,https://entero.ru/item/258205,"<p>Книга <a style=""text-decoration:none;cursor:text;"" href=""http://entero.ru/item/258205""><b class=""b"">Учебник бармена</b></a> предназначена для использования в сфере ресторанного бизнеса. Издание предназначено для полноценного обучения профессии «Бармен», а также в качестве справочника на рабочем месте бармена. В учебном пособии подробно раскрыты требования действующего профстандарта «Официант/бармен» № 910н от 01.12.2015 г., а также рассмотрены вопросы техники безопасности и приведены примеры официальных документов, с которыми работает бармен: кассовая книга, накладная, технико-технологическая карта, чек-лист, стоп-лист и другие.</p>

<p>В конце книги приведены рецептуры коктейлей с описанием, утверждённые Международной Барменской Ассоциацией (IBA).</p>

<p>Каждый QR-код, приведённый в данном учебнике, вы можете отсканировать любым предназначенным для этой цели приложением в смартфоне, которое автоматически перенаправит вас на нужную страницу сайта.</p>",258205,305 мм,230 мм,25 мм,1.43 кг,1,335x253x27 мм,0,https://entero.ru/manuals/318030/%D0%9F%D1%80%D0%B5%D0%B4%D0%B2%D0%B0%D1%80%D0%B8%D1%82%D0%B5%D0%BB%D1%8C%D0%BD%D1%8B%D0%B9%20%D0%BF%D1%80%D0%BE%D1%81%D0%BC%D0%BE%D1%82%D1%80.pdf,1.3 кг,60х90/8,Самашка П. Р. Крутилова Е. Е. Панов Я. В.,Ресторанные ведомости,978-5-6044967-6-3,2021,274,Твердый переплет,,,
